{
  "$schema": "https://json-schema.org/draft/2020-12/schema",
  "$id": "urn:content:npc",
  "title": "NPC",
  "type": "object",
  "additionalProperties": false,
  "required": ["id", "displayName", "templateId", "regionId", "position"],
  "properties": {
    "id": { "$ref": "urn:content:common#/$defs/npcId" },
    "displayName": { "$ref": "urn:content:common#/$defs/displayName" },
    "templateId": { "$ref": "urn:content:common#/$defs/templateId" },
    "regionId": { "$ref": "urn:content:common#/$defs/regionId" },
    "position": { "$ref": "urn:content:common#/$defs/vec3" },
    "rotation": { "$ref": "urn:content:common#/$defs/vec3" },
    "baseAttributes": { "$ref": "urn:content:common#/$defs/attributes" },
    "tags": { "$ref": "urn:content:common#/$defs/tags" },
    "dialogueId": { "$ref": "urn:content:common#/$defs/dialogueId" },
    "paletteId": { "$ref": "urn:content:common#/$defs/characterPaletteId" },
    "portrait": {
      "type": "object",
      "additionalProperties": false,
      "required": ["image"],
      "properties": {
        "image": { "type": "string", "minLength": 1 },
        "keywords": {
          "type": "array",
          "items": { "type": "string", "minLength": 1 },
          "uniqueItems": true
        }
      }
    },
    "questIds": {
      "type": "array",
      "items": { "$ref": "urn:content:common#/$defs/questId" },
      "uniqueItems": true
    },
    "vendor": {
      "type": "object",
      "additionalProperties": false,
      "required": ["sell", "buy"],
      "properties": {
        "sell": { "$ref": "urn:content:common#/$defs/priceTable" },
        "buy": { "$ref": "urn:content:common#/$defs/priceTable" }
      }
    },
    "patrol": {
      "type": "object",
      "additionalProperties": false,
      "required": ["waypoints"],
      "properties": {
        "waypoints": {
          "type": "array",
          "minItems": 2,
          "items": { "$ref": "urn:content:common#/$defs/vec3" }
        },
        "dwellMs": { "$ref": "urn:content:common#/$defs/dwellMs" }
      }
    },
    "reanchors": {
      "type": "array",
      "minItems": 1,
      "items": {
        "type": "object",
        "additionalProperties": false,
        "required": ["questId", "waypoints"],
        "properties": {
          "questId": { "$ref": "urn:content:common#/$defs/questId" },
          "waypoints": {
            "type": "array",
            "minItems": 2,
            "items": { "$ref": "urn:content:common#/$defs/vec3" }
          },
          "dwellMs": { "$ref": "urn:content:common#/$defs/dwellMs" }
        }
      }
    }
  }
}
